{
  "id": "handoff-runtime-to-cli",
  "fromAgentId": "codex",
  "toAgentId": "claude",
  "description": "The runtime shape is clear. Build the CLI on top of the same store so task and message writes stay consistent.",
  "timestamp": "2026-03-08T14:05:00Z",
  "relatedTaskIds": [
    "task-cli-foundation"
  ]
}
