{
  "id": "handoff-cli-to-sample",
  "fromAgentId": "claude",
  "toAgentId": "windsurf",
  "description": "Sample data should cover tasks, messages, decisions, conventions, logs, and a generated context file.",
  "timestamp": "2026-03-08T14:18:00Z",
  "relatedTaskIds": [
    "task-sample-data"
  ]
}
