{
  "id": "handoff-ui-to-runtime",
  "fromAgentId": "cursor",
  "toAgentId": "codex",
  "description": "The dashboard shell is ready for a real source adapter. Finish the parser and route status through a shared runtime.",
  "timestamp": "2026-03-08T13:50:00Z",
  "relatedTaskIds": [
    "task-local-runtime",
    "task-dashboard-hook"
  ]
}
